{
  "$schema": "https://raw.githubusercontent.com/znehraks/claude-symphony/main/schemas/agent.schema.json",
  "name": "debate-synthesizer-agent",
  "description": "Synthesizes multi-agent debate outputs into final deliverables, evaluates contention scores, and generates consensus from divergent agent perspectives",
  "tools": [
    "Read",
    "Glob",
    "Grep",
    "Write",
    "Bash",
    "Edit"
  ],
  "model": "reasoning",
  "permissionMode": "acceptEdits",
  "extendedThinking": true,
  "executionMode": "foreground"
}
